{
  "schema": "kenigevents.resolved-render-case.v1",
  "case_id": "eventcard.mobile-wide-calendar.8006",
  "control_generation": 3,
  "authority": {
    "input_bindings": {
      "corpus": {
        "path": "catalog/fixtures/ui-reference-events/v2/corpus.json",
        "sha256": "7578b63fcd8995b2ae957a047fd5e88ecdf40cba0b92b160f4145d43717096d5"
      },
      "projection": {
        "path": "catalog/fixtures/ui-reference-events/v2/projections/free-collection-september.v1.json",
        "sha256": "3170f8b1101a71924ba519ea6ce5bb86a2a454631bfee42e877a01a5e95c92ef"
      },
      "scenario": {
        "path": "catalog/fixtures/design-system-reference/v2/scenarios/archetype.collections.free.september.mobile-ready.v3.json",
        "sha256": "3dfe0a0f999a7714bf9a2ae733f1056cd0be8518d839e90a9932c7a66ae0ea9c"
      },
      "asset_manifest": {
        "path": "catalog/fixtures/ui-reference-events/v2/assets-manifest.json",
        "sha256": "3346a24aa37e72d7bdbb16858ae222d10a2b58011e8e6fb6624aff8009cce9da"
      },
      "component_contract": {
        "path": "catalog/ui-components/event-card-large/component-contract.v2.json",
        "sha256": "72385737a289f43090dd8d388497f755141e78f56a14576e4221fb817ab526fb"
      },
      "packed_rows": {
        "path": "catalog/ui-components/event-card-container/packed-rows.v1.json",
        "sha256": "a7aafdb8a5e51ce8e4efc7c7724d26d137dbe03d6d0e2d873d7dfc9a2d615767"
      },
      "astro_ref": "64f75d10f7aff33fa616cee212878bd9d03673b1",
      "astro_sources": [
        {
          "path": "site/src/components/EventCard.astro",
          "git_blob_sha1": "e7b299660572dda731ca15bd5052b3bf5714cd7c",
          "sha256": "92b2ec6e7d07d31d0e5e6e02a233e450e5961acf946e04231885ee86633693ee"
        },
        {
          "path": "site/src/components/Icon.astro",
          "git_blob_sha1": "68252498848a5fbc93dab20b5797504aeb6eb487",
          "sha256": "73ecf633d7959a16ad3f9845b7835b7210d79fbc9c6a99baccf1f098b0b5bf84"
        },
        {
          "path": "site/src/components/FreeCollectionSurface.astro",
          "git_blob_sha1": "c76e94893efc0241b555e2fa0eaa08ba789bb696",
          "sha256": "25d6db356a6ad03b434322f80460e43c1a015f96e2cbd3b5ae34b2948b586f38"
        },
        {
          "path": "site/src/components/OptimizedEventCardGrid.astro",
          "git_blob_sha1": "c3912ab56072f69565c372fbfa54c2262f06761e",
          "sha256": "cedea995c07486eeed408e0c94489ec61980d9578e516e73d8962f65fb47596c"
        },
        {
          "path": "site/src/layouts/EventLayout.astro",
          "git_blob_sha1": "f90eb29949841f72755254e52d58912fc6f27b2e",
          "sha256": "4c54c9fbfe44ab7164dfa3504d9d44137b0a76b490ca7fa85326b4b6034cb483"
        }
      ]
    },
    "generator": "scripts/ui_conformance/generate-free-collection-resolved-cases.mjs"
  },
  "payload": {
    "case_kind": "eventcard",
    "structural_context": "mobile-wide-calendar",
    "state": null,
    "scenario": {
      "scenario_id": "free-collection-september-mobile-v3",
      "viewport": {
        "width": 390,
        "height": 844,
        "dpr": 1
      },
      "review_states": [
        "top",
        "scrolled-fixed-navigation",
        "full-page"
      ]
    },
    "fixture_order": [
      "event.real.8006"
    ],
    "groups": {
      "events": [
        "event.real.8006",
        "event.real.8200"
      ],
      "exhibitions": [
        "event.real.2182",
        "event.real.6711",
        "event.real.7609"
      ]
    },
    "fixtures": [
      {
        "schema_version": "ui-reference-event.v2",
        "fixture_id": "event.real.8006",
        "event_id": 8006,
        "source_prod_id": 8006,
        "slug": "donorskaya-aktsiya-stan-donorom-krovi-gurevsk-8006",
        "source_repository_sha": "8710e56fa3685f6c30a90cd062d532dce0348cce",
        "source_static_build_id": "golden-event-corpus-v2-20260829",
        "source_snapshot": {
          "kind": "preview-export-catalog-revision",
          "sha256": "6668f5a6f22f6c9a4e1f28af242e77bedb81eab1d06a37ba1227c8898133f409"
        },
        "extracted_at": "2026-08-29T12:50:30.251434+00:00",
        "preview_event_sha256": "ad1a836f259ed7c744ab1a314ea7a0d6924de1f0b6539cebaea3cc30ca39a403",
        "payload_path": "events/event.real.8006.json",
        "coverage_tags": [
          "early-september",
          "portrait-poster",
          "ocr-protected",
          "single-image",
          "admission-free"
        ],
        "preview_event": {
          "id": 8006,
          "source_prod_id": 8006,
          "title": "Донорская акция «Стань донором крови»",
          "slug": "donorskaya-aktsiya-stan-donorom-krovi-gurevsk-8006",
          "event_type": "встреча",
          "festival": null,
          "organizer_names": [],
          "participants": [],
          "status_label": "Бесплатно",
          "lifecycle_status": "active",
          "semantic_record_version": "canonical-event-semantic-v1",
          "record_kind": "event",
          "eventness_status": "event",
          "identity_status": "canonical",
          "merged_into_event_id": null,
          "silent": false,
          "is_public": true,
          "is_searchable": true,
          "publication_status": "published",
          "starts_at": "2026-09-02T09:00:00+02:00",
          "start_date": "2026-09-02",
          "start_time": "09:00",
          "end_date": null,
          "end_at": null,
          "time_range_end": null,
          "duration_forecast_minutes": null,
          "timezone": "Europe/Kaliningrad",
          "display_date": "2026-09-02",
          "display_time": "09:00",
          "city": "Гурьевск",
          "venue_name": "Центр культуры и досуга",
          "address": "Калининградское шоссе 4а",
          "map_query": "Гурьевск, Центр культуры и досуга, Калининградское шоссе 4а",
          "ticket": {
            "kind": "phone",
            "label": "Позвонить организатору",
            "href": "tel:+74015139588",
            "status": "registration",
            "is_free": true,
            "price_label": null,
            "note": null
          },
          "age_restriction": "18+",
          "age_restriction_status": "declared",
          "age_restriction_provenance": "organizer_text",
          "age_restriction_decision_version": "event-age-decision-v1",
          "age_recommendation": null,
          "age_recommendation_label": null,
          "source_url": "https://vk.com/wall-69310304_50785",
          "source_urls": [
            "https://vk.com/wall-69310304_50785",
            "https://vk.com/wall-231920894_9531",
            "https://t.me/c/3954607218/3468",
            "https://t.me/kldevents/3468",
            "https://t.me/kenigeventscalendar/8495",
            "https://vk.com/wall-231920894_9498"
          ],
          "source_count": 6,
          "question_cta": {
            "provider": "vk",
            "url": "https://vk.com/wall-231920894_9531",
            "source": "managed_afisha_post"
          },
          "telegraph_url": "https://telegra.ph/Donorskaya-akciya-Stan-donorom-krovi-08-19",
          "image_url": "https://static.kenigevents.ru/p/image/v2/dd/dd8834258d4a1ebde029aca1960bdd224bdf636d3fd8aee8fc7824012475de8b.webp",
          "image_alt": "Афиша события «Донорская акция «Стань донором крови»»",
          "image_text_mode": "ocr_text",
          "image_media_role": "event_identity_poster",
          "image_assets": [
            {
              "src": "https://static.kenigevents.ru/p/image/v2/dd/dd8834258d4a1ebde029aca1960bdd224bdf636d3fd8aee8fc7824012475de8b.webp",
              "width": 1440,
              "height": 1920,
              "alt": "Афиша события «Донорская акция «Стань донором крови»»",
              "image_text_mode": "ocr_text",
              "media_role": "event_identity_poster",
              "media_role_confidence": 1,
              "media_semantic_status": "classified",
              "image_kind": "poster",
              "recommended_hero_fit": "contain",
              "safe_crop": false,
              "source_order": 0,
              "thumbnail_sources": [
                {
                  "src": "https://static.kenigevents.ru/p/thumb/v1/dd/dd8834258d4a1ebde029aca1960bdd224bdf636d3fd8aee8fc7824012475de8b/256.webp",
                  "width": 192,
                  "height": 256
                },
                {
                  "src": "https://static.kenigevents.ru/p/thumb/v1/dd/dd8834258d4a1ebde029aca1960bdd224bdf636d3fd8aee8fc7824012475de8b/512.webp",
                  "width": 384,
                  "height": 512
                }
              ],
              "geometry_id": 1904,
              "current_pixel_sha256": "6189faf63ef2789e73ace94aecdca2c369ff07e22f6ef9953afca676de6b1196",
              "geometry_pixel_sha256": "6189faf63ef2789e73ace94aecdca2c369ff07e22f6ef9953afca676de6b1196",
              "geometry_model": "gemma-4-31b-it",
              "geometry_prompt_version": "event-image-geometry-v1",
              "geometry_status": "classified",
              "geometry_coordinate_space": "normalized_0_1",
              "geometry_source_width": 1440,
              "geometry_source_height": 1920,
              "face_boxes": [],
              "valuable_region": {
                "x": 0,
                "y": 0,
                "w": 1,
                "h": 1,
                "confidence": 1
              },
              "geometry_reason_code": "full_informative_poster",
              "focal_point": {
                "x": 0.75,
                "y": 0.45
              },
              "recommended_object_position": "75% 45%",
              "asset_key": "dd8834258d4a1ebde029aca1960bdd224bdf636d3fd8aee8fc7824012475de8b",
              "quality_score": 14.7525
            }
          ],
          "video_assets": [],
          "face_boxes": [],
          "valuable_region": {
            "x": 0,
            "y": 0,
            "w": 1,
            "h": 1,
            "confidence": 1
          },
          "ocr_boxes": [],